d7vKr,8/1R3n2/r5k1/7p/4K3/2P1NP2/7P/8 w - - 4 43,f3f4 f7d6 e4e5 d6b7,1304,100,advantage endgame fork short,1300
dz173,3k4/p2n4/2Q3p1/P1pPq3/4P2p/7P/6P1/7K b - - 1 45,e5e4 c6a8 d8e7 d5d6 e7d6 a8e4,1304,100,crushing discoveredAttack endgame exposedKing long,1300
e1iiP,r5k1/pp3p1p/5np1/3pR3/8/2PQ1P2/PPB2PKP/2q5 b - - 2 21,f6h5 e5h5 g6h5 d3h7 g8f8 h7h8,1304,100,advantage endgame kingsideAttack long,1300
eGFLH,1k1rr3/pp3p2/3n4/2qP2Q1/2p4P/2P5/PPK5/4RR2 b - - 3 31,e8e1 g5d8 d6c8 f1e1 c5f2 c2d1,1304,100,advantage defensiveMove endgame hangingPiece intermezzo long,1300
eKxSJ,1r6/1Qpk1pp1/1pn3p1/1q1p4/3P4/P5PB/5P1P/2R3K1 b - - 5 25,d7d6 c1c6 b5c6 b7b8,1304,100,advantage endgame short,1300
eX0CD,3b3r/pp3R2/3p3p/5k1n/1P1P4/2P2n1N/P1KB3P/8 b - - 3 28,f5g4 h3f2 g4h4 f7f3,1304,100,crushing deflection middlegame short,1300
ekTDJ,rnb1r1k1/ppq2p1p/3b1Q2/3pp3/8/1PPB1N2/P4PPP/RN2R1K1 w - - 4 16,d3h7 g8h7,1304,100,equality hangingPiece oneMove opening,1300
evQDm,2Q5/1p3Npk/3rpn1p/8/1P2P3/3P3P/5qPK/1R6 b - - 4 36,d6d3 c8h8 h7g6 f7e5 g6h5 e5d3,1304,100,crushing endgame fork long,1300
fWEAM,r3r1k1/ppp2pp1/7p/2b5/2nB4/q2B1Q2/P4PPP/R4RK1 w - - 0 21,d3c4 a3f3 g2f3 c5d4,1304,100,advantage middlegame short,1300
g4y78,8/8/8/p5Q1/4p3/1P5P/q4k1K/8 b - - 0 60,e4e3 g5g2 f2e1 g2a2,1304,100,crushing endgame queenEndgame short skewer,1300
gCU16,r4qk1/1R3p2/1R4pQ/4p3/3nP1pP/6P1/5P2/6K1 w - - 9 34,h6g5 d4f3 g1g2 f3g5,1304,100,crushing endgame fork master short,1300
gsItj,k6r/pp3p2/3Q1n2/7p/6p1/P3P2P/5Pq1/2R1K2R w K - 2 26,h1h2 g2g1 e1d2 f6e4,1304,100,crushing endgame short,1300
gxrhA,5rk1/p1p2pnq/1p2nQ2/8/2B5/P2PR3/2P2PP1/6K1 b - - 8 33,h7g6 f6g6 f7g6 c4e6 g7e6 e3e6,1304,100,advantage long,1300
iAY0A,8/8/p1p5/Pp4pp/1P2k3/4P1P1/3K2P1/8 b - - 1 35,e4f5 d2d3 f5e5 e3e4 c6c5 b4c5,1304,100,crushing endgame long pawnEndgame quietMove,1300
jBqjg,8/4B3/6pk/3r1p1p/R7/8/P3K1PP/8 w - - 5 47,e2e3 d5e5 e3d2 e5e7,1304,100,endgame equality fork short,1300
jjdBo,rn2k2r/pp2qp2/6pb/5b1p/2B2p2/3P2B1/PPPQ2PP/2KR2NR w kq - 0 14,d1e1 f4g3 e1e7 e8e7 d2h6 h8h6,1304,100,advantage long opening pin,1300
kNCvd,8/8/6Kp/8/7P/5k2/8/8 b - - 3 59,f3g4 h4h5 g4f4 g6h6 f4f5 h6g7,1304,100,crushing endgame long pawnEndgame quietMove,1300
kissh,r1bq1k1r/3nb3/p1n1p1Q1/1p1pP1N1/3P4/P1N5/1P3PPP/R1B1K2R b KQ - 2 14,d8e8 g5e6,1304,100,mate mateIn1 middlegame oneMove,1300
lV9tB,R7/4r3/3k4/8/3K4/8/8/8 b - - 4 57,e7h7 a8a6 d6e7 a6a7 e7f6 a7h7,1304,100,crushing endgame exposedKing long rookEndgame skewer,1300
lsO75,8/p7/1p6/5k1R/1Pr2b2/P3p2P/3pK3/3B4 b - - 1 47,f5e6 d1b3 e6d6 b3c4,1304,100,advantage endgame pin short,1300
mi1R3,r1b2rk1/bp2q2p/p1pp4/6p1/1PP1RN2/P1Q3P1/1B3P1P/5RK1 b - - 0 20,e7e4 c3g7,1304,100,mate mateIn1 middlegame oneMove,1300
mvq5z,r3k1nr/pp2qppp/2P5/1Q6/8/4P3/PPn2PPP/RN2K1NR w KQkq - 1 13,e1e2 c2d4 e2d1 d4b5,1304,100,crushing middlegame pin short,1300
mworC,4r1k1/p4pbp/6p1/2p5/2P1b3/1P4P1/P4P1P/1RB1R1K1 w - - 0 19,f2f3 g7d4 g1g2 e4f3 g2f3 e8e1,1304,100,advantage discoveredAttack endgame long,1300
nAOFp,4r3/R6P/5k2/5p2/4p3/4K3/8/8 b - - 1 73,f6g5 a7g7 g5h6 g7g8 h6h7 g8e8,1304,100,crushing endgame long master rookEndgame,1300
o83U4,5rk1/1p4p1/p1b1p1Bp/4P3/8/8/6qP/5RQK w - - 0 27,g1g2 f8f1,1304,100,endgame mate mateIn1 oneMove pin,1300
oLiAB,5k2/8/P4Q1p/8/4B1p1/q3b2P/8/7K b - - 2 42,f8e8 e4c6,1304,100,endgame mate mateIn1 oneMove,1300
okeVz,r2q1rk1/4bpp1/p6p/1p1Np3/4P3/1P1P2PP/1PP2Q2/R4RK1 w - - 1 21,f2b6 d8b6 d5b6 e7c5 g1g2 c5b6,1304,100,advantage exposedKing fork long middlegame,1300
pDPT3,8/4qp2/1rk1n1p1/8/1p2Q3/1P1P1P2/6PP/R6K b - - 1 37,c6d7 a1a7 d7d6 a7e7,1304,100,advantage endgame short skewer,1300
pJsPN,8/1p5p/4p1p1/1k1pP1P1/3P3P/pP1NK3/Pb6/8 w - - 11 47,d3f4 b2c1 e3f3 c1f4 f3f4 b5b4,1304,100,crushing endgame long,1300
pQo2k,8/5k2/5n2/3pB1p1/2pP4/b1P1NP2/2K5/8 b - - 1 43,f7e6 e5f6 e6f6 e3d5,1304,100,advantage attraction capturingDefender endgame master short,1300
pXHr8,r5k1/1p2qpbp/2n2np1/p1p3N1/2Pp1P2/P2brRPP/1P4BK/R2QBN2 b - - 1 18,d3e2 f3e3 d4e3 d1e2,1304,100,advantage capturingDefender middlegame short,1300
pmkxP,8/1Q6/pqp2pB1/2kp1P1P/2n2b2/1R6/PPP5/2KN4 w - - 0 37,c1b1 c4d2 b1a1 d2b3 a2b3 b6b7,1304,100,advantage fork long middlegame,1300
pqKLA,1r3r2/5p1k/p1pp1Ppp/4b3/4P3/1qNRQ3/1P4RP/2K5 b - - 1 29,a6a5 e3h6 h7h6 d3h3,1304,100,attraction mate mateIn2 middlegame sacrifice short,1300
q1BOV,8/R6R/5k2/2pp4/1p2pK2/1b6/rP6/8 b - - 1 50,f6e6 h7h6,1304,100,endgame master mate mateIn1 oneMove,1300
q9V9r,r5k1/5pp1/2p1p1P1/2PpQ3/1P3P2/4P3/1R3K2/q7 b - - 0 44,a8a2 e5b8,1304,100,endgame master mate mateIn1 oneMove,1300
qW6pW,8/3q2k1/p4p1P/1p2p1p1/2r5/4Q1PR/5P1K/8 b - - 0 57,g7g6 h6h7 d7h7 h3h7,1304,100,advancedPawn advantage endgame master short,1300
qsiew,6R1/1Pk3p1/7p/8/7P/6K1/1r6/8 b - - 4 48,b2b7 g8g7 c7b6 g7b7 b6b7 g3g4 b7c6 g4h5,1304,100,crushing endgame exposedKing rookEndgame veryLong,1300
rINsc,1r2r3/5p1p/7R/2pBkp1P/2P5/1P2P3/5PP1/6K1 b - - 7 39,e8e7 f2f4,1304,100,endgame mate mateIn1 oneMove,1300
rd8R9,4r3/2p1qk1p/1p2b3/p4pp1/Q7/2P2P2/PP2R1PP/4R1K1 w - - 0 32,e2e6 e7c5 g1h1 e8e6 e1e6 f7e6,1304,100,discoveredAttack endgame equality long,1300
rjFLZ,rnbqk1nr/pp3ppp/3bp3/3pN3/2pP1B2/1P2P3/P1P2PPP/RN1QKB1R b KQkq - 2 6,f7f6 d1h5 g7g6 e5g6 h7g6 h5h8,1304,100,advantage long opening pin trappedPiece,1300
s4Teu,r3r1k1/pppR1ppp/2n3n1/6q1/2Q5/8/PPP3PP/1K1R4 b - - 1 22,a8d8 c4f7 g8h8 f7g7,1304,100,kingsideAttack mate mateIn2 middlegame short,1300
sXdJe,8/8/8/6P1/6K1/8/kp1N4/1b6 w - - 2 65,d2f3 b1f5 g4f5 b2b1q,1304,100,advancedPawn attraction crushing endgame master promotion short,1300
shNug,8/pQp3pp/2p3r1/k1q1p3/P4n2/2PP4/1R3P1P/5R1K w - - 2 32,f1b1 c5d5 f2f3 d5f3 b2g2 f3g2,1304,100,endgame long mate mateIn3,1300
skHGQ,8/kp3p1R/p5p1/2p5/8/2P3q1/PP5p/K2Q4 w - - 2 44,d1h1 g3g1 h1g1 h2g1q,1304,100,advancedPawn backRankMate endgame mate mateIn2 promotion short,1300
ss1jA,r3r1k1/3n1p1p/2p3p1/pPPb4/P2Q1P2/1NKB2qP/6P1/4R2R w - - 5 25,b5b6 e8e1 h1e1 g3e1,1304,100,crushing middlegame short,1300
t1EY7,4q1rr/1b2k3/pp2p3/6pp/P1Q1P3/2P5/1P3RPP/4R2K b - - 0 31,g5g4 c4c7 e8d7 f2f7 e7f7 c7d7,1304,100,attraction crushing deflection fork long middlegame pin,1300
tVRUJ,3r2k1/8/6p1/7p/1P6/P1R1R3/r6P/7K w - - 13 45,h2h4 d8d1 e3e1 d1e1,1304,100,endgame mate mateIn2 rookEndgame short,1300
u1Tf8,6k1/2p5/1p1pNqp1/p2Pb3/2P3PK/PP2Q2P/8/8 w - - 1 50,g4g5 f6h8 h4g4 h8h5,1304,100,endgame mate mateIn2 short,1300
u1k6h,3q4/pp3k1p/n1r2p2/3p4/3P2Q1/4R2P/PP3PP1/6K1 b - - 5 23,d8d6 g4h5 f7g7 e3g3 d6g3 f2g3,1304,100,advantage endgame long,1300
ud32O,1nk5/K4ppp/1P2p3/8/P7/2b1B1P1/5P1P/8 b - - 0 40,f7f6 b6b7 c8c7 e3b6,1304,100,advancedPawn advantage endgame short,1300
v7NQY,6k1/5p1p/6p1/1p1Bp2q/3PPb2/1PP2NR1/4QPK1/r7 w - - 3 27,f3g1 a1g1 g2g1 h5e2,1304,100,crushing middlegame short,1300
v8XKY,2r3k1/5pp1/7p/Q6P/Pp4q1/1P6/2P5/1K5R b - - 0 29,c8c2 a5d8 g8h7 d8d3 f7f5 d3c2,1304,100,crushing endgame fork long,1300
vC7bI,3r2k1/5p1p/pQ1p2pP/1p2n3/2r1Pp1N/2P2Pq1/PP2K1P1/3R3R b - - 2 25,c4c6 b6d8,1304,100,hangingPiece mate mateIn1 oneMove,1300
vvYUE,6k1/5R2/4PKp1/7p/r6P/6P1/8/8 w - - 3 60,e6e7 a4a6 f6e5 g8f7 e7e8q f7e8,1304,100,crushing deflection endgame long rookEndgame,1300
vxCYN,2R5/6bk/pB5p/6p1/qP6/2p4P/5PP1/4R1K1 w - - 2 40,e1e7 a4d1 g1h2 d1d6,1304,100,crushing endgame short,1300
woL7R,1Q6/4pk1p/q2p2pP/2n1p1P1/4P3/2P2P2/rP1KN3/1R6 w - - 3 34,b8h8 a6d3 d2e1 d3b1,1304,100,crushing endgame fork short,1300
xYIQW,4r3/4ppk1/3p2p1/q1pPN1P1/2P5/p3Q3/Pr3PK1/7R b - - 5 36,d6e5 e3e5 f7f6 g5f6 e7f6 e5e8,1304,100,crushing endgame long master,1300
yWliT,r4rk1/pp3ppp/4b3/2p5/2Bn2q1/2Q3R1/PB3PPP/5RK1 b - - 3 21,e6c4 g3g4 d4e2 g1h1 e2c3 b2c3,1304,100,advantage hangingPiece long master middlegame,1300
yfmFZ,3r2k1/pp2R1bp/6p1/6B1/6n1/2N5/PP3r1P/R5K1 b - - 1 18,f2b2 e7g7 g8g7 g5d8,1304,100,discoveredAttack equality middlegame short,1300
zdLzO,3r1bk1/5Rpp/8/8/3pp1P1/1B6/P3K2P/8 b - - 0 40,g7g6 f7d7 g8h8 d7d8,1304,100,crushing discoveredAttack endgame pin short,1300
zoFsI,3r3r/1p2kpb1/1Bp5/3p3p/P1P2P2/1P5R/4K3/7R b - - 0 36,d8d7 h3e3 e7f8 b6c5,1304,100,advantage endgame master short,1300
03WcF,8/8/8/1k4p1/2q5/2Q5/2K5/8 w - - 20 62,c3c4 b5c4 c2d2 c4d4 d2e2 d4e4,1305,100,crushing defensiveMove endgame long zugzwang,1300
09ZdN,r1b3k1/1pp1qnpp/p2r4/5p2/8/1B4Q1/PPP2PPP/3RR1K1 w - - 0 22,b3f7 e7f7 d1d6 c7d6,1305,100,advantage middlegame short,1300
0HCJb,6R1/p4k2/4p2p/2PrBb1P/5K2/8/P7/8 w - - 1 44,c5c6 f7g8 c6c7 d5c5,1305,100,advantage endgame hangingPiece short,1300
0O5iD,3r4/1pR2R1p/p5k1/8/8/2P5/Pr4PP/6K1 w - - 6 32,c7b7 d8d1 f7f1 d1f1 g1f1 b2b7,1305,100,crushing endgame long rookEndgame,1300
1Lkaf,r3k2N/ppp5/2npbq1p/2b1p3/2B1P3/3P4/PPP2PPP/RN1QK2R w KQq - 0 11,c4e6 f6f2,1305,100,attackingF2F7 mate mateIn1 middlegame oneMove,1300
2s2Wk,r1bqkb1r/2Bnp1pp/5p2/1Npn4/1p6/8/PP2QPPP/R3KBNR b KQkq - 1 12,d5c7 b5d6,1305,100,mate mateIn1 oneMove opening pin,1300
3Cfqo,rnb1k1nr/pp1ppp1p/6p1/8/5B2/2q1P3/P2N1PPP/R2QKB1R b KQkq - 1 10,g8f6 a1c1 c3c1 d1c1,1305,100,advantage opening short,1300
3Ev4g,4rk1Q/pp1q1rb1/3p1p2/4pN2/2Pp4/3P4/PP4K1/R1B4R b - - 5 23,g7h8 h1h8,1305,100,master mate mateIn1 middlegame oneMove,1300
3KDGO,8/5p2/1kp3p1/p3P2p/P1K4P/6P1/8/8 b - - 0 41,b6c7 c4c5 c7b7 c5d6 b7b6 d6e7 c6c5 e7f7,1305,100,advantage endgame pawnEndgame veryLong zugzwang,1300
3laRt,r6k/6R1/5PK1/8/8/8/8/8 w - - 7 65,f6f7 a8a6 g6f5 h8g7,1305,100,crushing deflection endgame rookEndgame short,1300
3saz6,4kb2/p6p/4p1p1/4BpP1/2pPbP1P/3n4/1PKR4/6R1 w - - 6 36,c2c3 f8b4 c3c4 b4d2,1305,100,advantage endgame short skewer,1300
3yBZe,r3k3/ppQ2pp1/2p1pn2/6Nr/3P2nP/8/1PPK1PP1/q2R3R b q - 3 18,a1b2 c7f7 e8d8 g5e6 d8c8 f7c7,1305,100,attackingF2F7 long mate mateIn3 middlegame,1300
3yOR5,6rk/R4Qp1/6Pp/7P/3pq3/p4P2/6K1/8 b - - 0 41,e4e5 f7g8 h8g8 a7a8 e5b8 a8b8,1305,100,attraction endgame long mate mateIn3 sacrifice,1300
415vH,r2qkbnr/ppp1pppp/8/n3N3/2BP2b1/4P3/PP3PPP/RNBQK2R b KQkq - 2 6,g4d1 c4f7,1305,100,attackingF2F7 mate mateIn1 oneMove opening,1300
44sZo,1k6/1pb2p2/P2r4/1p2p1Pp/4P2P/2P2P2/1qB2Q2/R4RK1 w - - 1 41,a6b7 c7b6 f2b6 d6b6,1305,100,advantage middlegame pin short,1300
4DSHM,r7/7p/6p1/2r2p2/kn6/4P1P1/p1N2P1P/R1RK4 b - - 0 47,b4d3 a1a2 a4b3 a2a8,1305,100,advantage endgame short skewer,1300
4HW2h,8/1k5r/8/1p6/3R1QP1/1P6/P3q1KP/8 w - - 3 48,f4f2 h7h2 g2h2 e2f2,1305,100,attraction crushing deflection endgame short,1300
4UIeI,rnbk2nr/pppp2Q1/3b3p/3NN3/2B1q3/4B3/PP3PPP/R3K2R b KQ - 1 12,d6e5 g7f8,1305,100,mate mateIn1 middlegame oneMove,1300
63hkm,8/6p1/5p1p/4pP2/3kP1P1/1p1P3P/4K3/3N2b1 b - - 1 34,g1e3 d1e3 b3b2 e3c2 d4c5 c2a3,1305,100,crushing defensiveMove endgame long,1300
6CRAz,8/5kr1/1r1pR2R/p1p2B2/2P2p2/1P2p3/P5bP/4K3 b - - 3 41,g2f3 h6f6 f7g8 e6e8,1305,100,endgame mate mateIn2 short,1300
6ovFO,1R6/pp3Npk/5n2/3r3p/P7/1P3P2/5K2/8 b - - 2 36,d5d7 b8h8 h7g6 f7e5 g6f5 e5d7,1305,100,advantage endgame fork long,1300
73F8q,r1b3r1/pp2Qp1k/4p2b/2p1q3/4P1nP/P1NP4/BPP2PP1/1K1R3R b - - 2 22,g4f2 e7f7 h6g7 f7f2,1305,100,advantage fork middlegame short,1300
7Xnph,4r3/5p1k/6pp/5Q2/1p1p4/3P1b2/PPP2qPP/2R4K w - - 0 36,f5f3 e8e1 c1e1 f2e1 f3f1 e1f1,1305,100,endgame long mate mateIn3,1300
7eRQ1,8/3b2p1/3k1p1p/1p1Bp2P/pPp1K1P1/P4P2/1PP5/8 b - - 2 32,d7c6 d5c6 d6c6 e4f5 c4c3 b2c3,1305,100,bishopEndgame crushing endgame long,1300
8HfnP,5rk1/pp3p2/4p1pR/3p4/3P1P2/7Q/Pq1bN1PP/5K2 b - - 1 33,d2f4 h6h8 g8g7 h3h7 g7f6 h8f8 b2b1 f1f2,1305,100,crushing deflection endgame veryLong,1300
91Vok,8/3R3p/8/6P1/8/8/r3pK2/2k5 w - - 3 46,d7h7 c1d1 h7d7 a2d2 d7d2 d1d2,1305,100,crushing defensiveMove endgame long rookEndgame,1300
AYZyy,5q1k/2r3pP/p2p3P/1p2p1R1/4B3/4n3/PPP5/1K5R b - - 0 29,f8f4 h6g7 c7g7 g5g7,1305,100,advancedPawn crushing endgame short,1300
ArxYc,4k2r/5p2/p2Q1p2/4pb1P/8/K1q2P2/8/3R3R w k - 2 30,a3a4 f5c2,1305,100,endgame mate mateIn1 oneMove,1300
AwNug,8/2k1nQ2/5P2/8/6P1/4q3/1p4K1/8 w - - 0 54,f7e7 e3e7 f6e7 c7d7 e7e8q d7e8,1305,100,crushing endgame long queenEndgame,1300
B3W3J,8/6p1/2k5/Kp2p1p1/p3P1Pp/2p2P1P/PPP5/8 w - - 0 33,b2b3 a4b3 a2b3 c6c5,1305,100,crushing defensiveMove endgame pawnEndgame short,1300
BHNPd,5rk1/2p3p1/4p2p/P1Q5/2P4q/8/6PP/4R1K1 w - - 0 34,c5e5 h4f2 g1h1 f2f1 e1f1 f8f1,1305,100,backRankMate endgame long mate mateIn3 sacrifice,1300
BsbbP,6rb/2k2p1p/PR2p3/2p3q1/2pp4/4PP2/2PP3P/1Q3R1K w - - 1 24,f1g1 g5g1 b1g1 g8g1 h1g1 c7b6,1305,100,crushing endgame kingsideAttack long,1300
CCeP8,8/8/3R4/3P4/5k2/6p1/4r3/6K1 b - - 0 61,f4e5 d6e6 e5d5 e6e2,1305,100,crushing rookEndgame short skewer,1300
DFFRJ,5k2/1R3p1p/4p3/pN1n4/2b5/P5R1/5KPP/2r5 w - - 7 38,b5d6 c1f1,1305,100,endgame mate mateIn1 oneMove,1300
DOBYJ,4Q3/1p4pk/p1p4p/P2p1p2/1P1P4/2PN1PbP/6Pq/5K2 w - - 3 28,e8f7 h2h1 f1e2 h1g2,1305,100,advantage deflection endgame master short,1300
Dfsw2,8/1p1b1k2/2p2qp1/1p1p1p2/1P6/P1r3P1/5P2/1B2R1KQ b - - 1 41,c3a3 h1h7 f6g7 e1e7 f7e7 h7g7,1305,100,advantage attraction deflection endgame long,1300
E41hq,3r2k1/1p2P3/p4p2/8/1P4q1/P3P3/1BQ2PK1/3R4 w - - 5 36,g2f1 d8d1 c2d1 g4d1,1305,100,crushing endgame short,1300
EGnO5,4R3/6p1/2k2p2/8/2r4p/1pB2P1P/1Pb2KP1/8 b - - 3 37,c4c3 e8c8 c6d6 c8c3,1305,100,advantage endgame short skewer,1300
EMLsN,2kr1r2/pp5p/2pq3Q/3b4/4pn2/4P3/PP1NBPP1/3R1RK1 w - - 2 28,h6d6 f4e2 g1h2 d8d6,1305,100,advantage hangingPiece intermezzo middlegame short,1300
EltUv,2kr2r1/pbp3b1/1pn1p1Np/3qPp2/P2P1Bp1/1NP5/1P4PP/R2Q1RK1 b - - 0 17,c6d4 g6e7 c8b8 e7d5,1305,100,advantage fork middlegame short,1300
Es2vU,6k1/1p3rb1/8/4p3/4P3/P5Q1/2q1KBRP/8 w - - 5 45,e2f1 c2d1,1305,100,endgame master mate mateIn1 oneMove,1300
FTQcR,8/8/8/2k5/3p4/1PrR4/8/5K2 w - - 13 64,d3c3 d4c3 f1e1 c5b4,1305,100,crushing endgame short,1300
FW9W5,1r5k/3N1p2/1PR1pN1p/6p1/8/4n3/r1P5/2K5 b - - 2 35,b8b7 c6c8 h8g7 c8g8,1305,100,endgame master mate mateIn2 short,1300
FxJwi,8/2p2p2/k1p4r/p3q3/2P1P3/3P1Q2/5PKP/1R6 w - - 16 43,f3g3 h6g6 g3g6 f7g6,1305,100,advantage endgame pin short,1300
Gl1ye,5rk1/3P1pp1/pb6/4p2q/2B1Pn1p/P3Q2P/5P2/1R1R3K w - - 0 38,e3b6 h5f3 h1g1 f3g2,1305,100,master mate mateIn2 middlegame short,1300
GqnMM,r6k/ppp3pp/4Q1b1/5nq1/3P4/2P5/P3R1PP/4R1K1 b - - 1 25,f5h4 e6e8 g6e8 e2e8 a8e8 e1e8,1305,100,backRankMate long mate mateIn3 middlegame sacrifice,1300
GxlcK,3k4/p1p5/4p1q1/1Q3n2/3P4/P1P3N1/1P3RK1/8 w - - 3 42,b5d3 f5h4 g2h3 g6d3,1305,100,discoveredAttack endgame equality short,1300
Hlovq,N1b3nr/pp1k1ppp/2n1p3/3p4/1b6/4BN2/PqP1BPPP/R2QK2R w KQ - 1 11,c2c3 b4c3 e1f1 b2a1 d1a1 c3a1,1305,100,advantage long middlegame,1300
ILP9K,2r2k2/R7/8/8/Q2P4/4P3/1q4PP/2r2BK1 w - - 13 45,a4d7 c1f1 g1f1 c8c1,1305,100,attraction endgame mate mateIn2 sacrifice short,1300
InCVg,r3r3/pp4b1/2nBpkp1/3q1bN1/7Q/2P5/P4PPP/R4RK1 b - - 3 23,d5d6 g5e4 f6f7 e4d6,1305,100,advantage doubleCheck fork master middlegame short,1300
K3DBb,8/8/7p/p4Kp1/8/Pk1N3P/4n1P1/8 w - - 0 52,f5g6 e2f4 d3f4 g5f4,1305,100,crushing endgame knightEndgame master short,1300
KJnfQ,r4b1r/1ppb2pp/p1nk1n2/3p3Q/5q2/2N2P2/PPP3PP/3RR1K1 b - - 1 16,f6h5 d1d5,1305,100,mate mateIn1 middlegame oneMove,1300
KxiM8,6k1/p2r2pp/4pB2/6Q1/2P4P/3p1N2/PPq5/K3R3 w - - 1 27,e1e6 c2d1 g5c1 d1c1,1305,100,endgame fork mate mateIn2 short,1300
L3nSm,6k1/4pp1p/3p2p1/2n5/8/2R1PP1P/rrp3P1/2R1B1K1 b - - 2 33,c5b3 c3c8 g8g7 e1c3 f7f6 c3b2,1305,100,endgame equality fork long,1300
LXjVW,2r1r1k1/5pp1/p6p/1p1N4/1P3N1P/P5R1/6PK/4n3 b - - 6 30,c8c2 d5f6 g8f8 f6e8,1305,100,advantage endgame pin short,1300
LkAX9,5r1k/2p2Pp1/1p5p/pP1r1R2/4q2P/P1Q3P1/5R1K/8 w - - 0 35,c3c7 d5f5 f2f5 e4f5,1305,100,crushing endgame short,1300
Ln6Es,1kn5/ppp2p1Q/2qpr3/3N4/5P2/6P1/PPP1r2P/1K1R3R w - - 3 23,d5c3 c6h1 d1h1 e2e1 c3d1 e1h1,1305,100,advantage attraction long middlegame pin sacrifice,1300
Lri0U,8/pR5Q/4k1p1/p3pp2/8/6P1/2q1KP1P/8 w - - 5 47,e2f3 c2e4,1305,100,endgame mate mateIn1 oneMove,1300
MoMoV,2k1r3/1pp2ppp/3n4/p2N4/q7/2R5/1PP2PPN/5RK1 b - - 5 20,d6b5 d5b6 c8b8 b6a4,1305,100,advantage middlegame pin short,1300
Nr48w,2r3k1/pp2b1p1/1qn1prNp/3p4/3Pp1Q1/1P2P2P/PB4P1/R4RK1 b - - 1 21,c8e8 g6e7 c6e7 f1f6,1305,100,advantage kingsideAttack middlegame pin short,1300
OK0rU,r1bq3r/1ppp2p1/p2b2k1/4B3/1P2P1n1/2N5/P1P3PP/R2Q1RK1 b - - 0 13,d6e5 d1g4 d8g5 g4g5 g6g5 f1f5 g5h6 f5e5,1305,100,advantage attraction exposedKing fork hangingPiece middlegame veryLong,1300
OWPut,r5k1/pp4p1/1qp1p2p/4n3/4B3/2P1P2P/P3Q1P1/5RK1 b - - 0 20,a8f8 e4h7 g8h7 f1f8,1305,100,advantage deflection endgame short,1300
Oh5HC,8/1PR2pp1/5k2/2K1pP1p/7P/8/8/4r3 b - - 0 56,e1b1 c7c6 f6f5 c6b6 b1b6 c5b6,1305,100,crushing endgame long master rookEndgame,1300
P6J8e,r5k1/p5p1/1p4Bp/2bpr3/8/2P2PK1/P1P4P/1R3R2 w - - 0 22,b1e1 e5g5 g3h3 g5g6,1305,100,crushing endgame fork short,1300
PLJod,3r1r1k/5qb1/7p/2p1P2Q/1pP2P2/pP4P1/P2R3K/4R3 w - - 0 36,h5f7 d8d2 h2h3 f8f7,1305,100,crushing endgame hangingPiece intermezzo short,1300
Q35MC,r3k2r/p5pp/p2nNp2/3p4/4bQP1/P1P1P2q/3B4/3K1R2 b kq - 3 27,e8f7 e6g5 f7e7 g5h3,1305,100,advantage middlegame pin short,1300
QtChP,3Q2k1/2p2pp1/2P2n1p/1Pq5/5P2/r1N1pKP1/4B2P/8 b - - 5 32,g8h7 e2d3 g7g6 d8f6,1305,100,advantage deflection endgame short,1300
RCsay,r6k/1p2b1pp/p2q4/3B1p2/4p3/1NP2nPr/PP2QPK1/3R1R2 w - - 0 27,g2h3 d6h6 h3g2 h6h2,1305,100,mate mateIn2 middlegame short,1300
RGo01,8/p7/2B5/PPk5/5p2/5Pb1/6Kp/8 b - - 0 53,c5b4 b5b6 g3f2 b6b7,1305,100,advancedPawn bishopEndgame crushing endgame short,1300
RmVZE,q1r3k1/5p1p/4pQp1/p2b4/3P4/2n1PN2/3N1PPP/1R3RK1 w - - 10 26,f3g5 c3e2 g1h1 d5g2,1305,100,kingsideAttack mate mateIn2 middlegame short,1300
RomsN,8/6bk/3N2pp/pp2p3/6P1/PB6/2P2qQr/3R3K w - - 0 35,g2h2 f2f3 h2g2 f3d1 h1h2 d1d6,1305,100,advantage endgame exposedKing fork long,1300
SFxht,8/1p4p1/pn1k2Pp/3b4/3N1r1P/1PP5/P3R3/2K5 b - - 0 30,f4h4 d4f5 d6d7 f5h4,1305,100,advantage endgame fork master short,1300
SLisj,5k2/7R/pr6/3B4/2K3n1/6P1/5P2/8 b - - 7 45,g4f2 h7f7 f8e8 f7f2,1305,100,crushing endgame fork short,1300
SOHo8,4br2/4p3/3p3k/3P2RP/2P3K1/1P6/r1B1R3/8 w - - 5 57,g4h4 f8f4 g5g4 f4g4 h4g4 e8h5 g4f5 h5e2,1305,100,attraction crushing endgame skewer veryLong,1300
SRlUH,8/3N2pk/7p/3p4/8/1R6/1r1r2PP/1R1K4 w - - 4 33,d1c1 b2c2,1305,100,endgame mate mateIn1 oneMove,1300
Sa10P,3r1rk1/2p2ppp/p3P3/1p1P3q/7b/1P6/PB3PQP/3RR2K b - - 0 25,f7e6 g2g7,1305,100,kingsideAttack mate mateIn1 middlegame oneMove,1300
Sg5zp,r5rk/pp5p/2n4q/4P2b/2R1B3/1Q3N1P/PP2NK2/7R w - - 7 27,b3e3 g8g2 f2g2 h6e3,1305,100,crushing deflection master middlegame short,1300
TDoks,r5k1/r3bpp1/2p1b2P/1p6/3pN2P/1q1B4/P2RQP2/1K5R w - - 0 23,a2b3 a7a1 b1c2 a8a2,1305,100,mate mateIn2 middlegame queensideAttack short,1300
TtWvZ,6r1/7k/7p/1p1p1q2/p1pP3P/P3PPR1/1P2QK2/8 w - - 1 41,e2f1 f5c2 f1e2 c2e2 f2e2 g8g3,1305,100,crushing endgame long,1300
UHIAj,8/4P1R1/rp1k1p2/4r3/2K5/1R4P1/8/8 b - - 0 41,e5e7 b3d3 d6c6 g7e7,1305,100,advantage deflection endgame rookEndgame short,1300
V1Ois,6k1/1R6/6K1/P6p/1P4p1/8/r7/8 b - - 1 45,g4g3 b7b8,1305,100,endgame master mate mateIn1 oneMove rookEndgame,1300
VegKW,rn2k2r/pp3Npp/4pqP1/3p4/3b4/8/P1QB1P2/4KB1R w Kkq - 2 18,f7h8 f6f2 e1d1 f2f3 f1e2 f3h1,1305,100,advantage attackingF2F7 fork long middlegame,1300
W4wIZ,4r1k1/5p1p/p2q2p1/1p1P4/PP6/5BP1/3n1P1P/Q1R3K1 w - - 1 26,f3g2 d2b3 c1e1 b3a1 e1e8 g8g7,1305,100,advantage endgame fork long,1300
W7jBL,r5k1/p3r2p/7q/3P4/2PN4/1P1B2p1/P4RP1/Q5K1 w - - 0 32,f2f3 h6h2 g1f1 h2h1,1305,100,mate mateIn2 middlegame short,1300
WN7yj,8/8/2k2p2/1p3p2/p2P1P1p/P1P1K2P/8/8 b - - 5 48,c6d5 e3d3 d5d6 c3c4 b5c4 d3c4,1305,100,crushing endgame long pawnEndgame zugzwang,1300
WPerJ,1q5k/3p1Qpp/p2Pp3/8/2P5/8/P5PP/1r3RK1 w - - 5 27,f7d7 b8b6 c4c5 b6c5 g1h1 b1f1,1305,100,backRankMate deflection endgame long mate mateIn3,1300
WWLpT,r2qr1k1/1pb2ppp/p7/3n4/2BPp3/BP2P3/P1Q3PP/3R1RK1 b - - 1 22,d5e3 c4f7 g8h8 f7e8,1305,100,advantage fork middlegame short,1300
WzZG1,8/3R4/p3pbk1/1p1R2N1/5PK1/2r5/P6r/8 b - - 0 38,e6d5 f4f5 g6h6 d7h7,1305,100,endgame mate mateIn2 short,1300
YbuyQ,r5k1/p1rnqppp/1p6/2pRP3/4p1Q1/1P2P3/PB3PPP/5RK1 w - - 3 19,g4e4 d7f6 e4f3 f6d5,1305,100,advantage master middlegame short,1300
YcewO,4r1k1/p1p2ppp/4rn2/6Bq/8/2N3Q1/PPP2PPP/R2R2K1 w - - 5 21,g5f6 h5d1 a1d1 e6e1 d1e1 e8e1,1305,100,backRankMate long mate mateIn3 middlegame sacrifice,1300
Yelo8,8/5k1p/PB6/1P3p2/8/3p3P/6P1/b5K1 w - - 0 43,b6e3 a1d4 e3d4 d3d2 a6a7 d2d1q,1305,100,advancedPawn advantage bishopEndgame endgame long promotion sacrifice,1300
Z1tQO,1r2nr1k/p3N1b1/5pPQ/2p1P3/3p1P2/8/2q2BP1/3R1K1R b - - 0 26,g7h6 h1h6 h8g7 h6h7,1305,100,mate mateIn2 middlegame short,1300
Z3GsI,1r3r2/p2b2k1/4pq2/Q7/P2P4/4PN2/5PPP/5RK1 b - - 0 29,d7c6 a5c7 g7h8 c7c6,1305,100,advantage fork middlegame short,1300
Zjxyr,r4r1k/p1Q4p/5n2/2b1p2q/4P3/P2B2p1/1B1N1PNP/R4RK1 w - - 0 23,c7e5 h5h2,1305,100,kingsideAttack mate mateIn1 middlegame oneMove,1300
Zz4QR,r4r2/1bq2Bk1/pp4pb/2n1p1N1/P3N3/2P4P/1P2Q1P1/3R1RK1 w - - 3 25,e4c5 c7c5 g1h1 h6g5,1305,100,advantage master middlegame short,1300
a6Fmj,8/8/8/4K3/5Pk1/1N1nP3/p6P/8 w - - 3 59,e5e6 d3c5 b3c5 a2a1q,1305,100,advancedPawn advantage deflection endgame knightEndgame promotion short,1300
a8QzE,rn2k2r/1bp1nNbp/p3p1p1/1p1qP3/3P4/3B4/PPP3PP/RNBQ1RK1 w kq - 1 11,f7h8 d5g2,1305,100,kingsideAttack mate mateIn1 middlegame oneMove,1300
b3DP7,r1n2rk1/1p3ppp/p2qp3/3p1b2/N2N3Q/1B5P/PPP3R1/2K1R3 w - - 1 21,h4f6 d6f4 c1b1 f5c2 b3c2 f4f6,1305,100,advantage discoveredAttack long middlegame,1300
b5pNb,r1b2k1r/ppp3p1/2np3p/2bBN2q/3p3B/8/PPPN1PPP/R2QR1K1 b - - 0 13,h5d1 e5g6,1305,100,mate mateIn1 middlegame oneMove,1300
bSjKM,8/8/4B2P/3p2P1/2kbp3/1p6/8/3K4 b - - 0 51,c4c5 g5g6 c5d6 g6g7 d6e6 g7g8q,1305,100,advancedPawn bishopEndgame crushing endgame long master promotion,1300
bZc4n,8/1p1R1k2/p5pp/P1B2p2/1P3r2/7P/5PK1/4r3 b - - 1 36,f7e6 d7e7 e6f6 e7e1,1305,100,advantage endgame short skewer,1300
byEH1,r1bqr1k1/p3bp2/1pp1pn1Q/6N1/2PP4/8/PPB2PPP/R4RK1 b - - 2 18,e7f8 c2h7 f6h7 h6h7,1305,100,kingsideAttack mate mateIn2 middlegame short,1300
cBLe0,5r1k/2r3pR/8/1p1BqP2/p2pP2P/P7/1Pp3Q1/6RK b - - 0 37,h8h7 g2g6 h7h8 g6h5,1305,100,endgame mate mateIn2 short,1300
cRBS0,2k3r1/p7/1pPP4/7p/5p2/2QP3q/P1P1R2P/7K w - - 0 31,c3e1 h3f3 e2g2 f3g2,1305,100,endgame mate mateIn2 short,1300
cgsLl,8/p4p2/5N2/6R1/6bP/2B2kb1/PPr5/7K w - - 0 40,g5g4 c2c1 c3e1 c1e1,1305,100,endgame mate mateIn2 short,1300
dPnpI,8/8/1p1kp1pp/8/P2K1P1P/8/5P2/8 b - - 3 43,d6c6 d4e5 c6d7 e5f6,1305,100,crushing endgame pawnEndgame short,1300
dckLR,5rk1/1b3qpp/p4p2/3ppN2/3P2Q1/7R/2r2PPP/R5K1 b - - 1 24,b7c8 f5h6 g8h8 h6f7,1305,100,crushing kingsideAttack middlegame pin short,1300
dmQKk,7k/5p2/3q4/8/5P2/1P2P3/P1QK1R2/7r w - - 5 43,c2d3 h1d1 d2d1 d6d3,1305,100,advantage attraction deflection endgame short,1300
eCvZA,2r2rk1/pbqn1ppp/1p2p3/2b1P1B1/8/P1Q2NP1/1P3PBP/2R1R1K1 w - - 3 17,b2b4 c5f2 g1f2 c7c3 c1c3 c8c3,1305,100,advantage discoveredAttack long middlegame,1300
eHNxn,1nQ5/p1p1bk1p/3p1rp1/8/8/8/P1qBKPPP/RN3R2 w - - 4 21,f2f3 f6e6 c8e6 f7e6,1305,100,advantage middlegame short,1300
eMVjr,6rk/1R4R1/1p4K1/p1p4p/3p4/Pr6/7P/8 b - - 2 40,b3e3 g7g8 h8g8 b7b8 e3e8 b8e8,1305,100,attraction endgame exposedKing long mate mateIn3 rookEndgame,1300
ekK9g,8/8/8/8/6RK/5k2/8/3r4 w - - 5 64,g4g8 d1h1 h4g5 h1g1 g5f6 g1g8,1305,100,crushing endgame long rookEndgame skewer,1300
ezpEA,3R4/pp2rpkp/2p3p1/6q1/P2Q2P1/6KP/5P2/8 b - - 10 32,g5f6 d8g8 g7g8 d4f6,1305,100,advantage deflection endgame short,1300
fapy7,8/K7/1p4B1/2p5/Pn1p4/1P2k3/8/8 b - - 0 54,d4d3 g6d3,1305,100,endgame equality oneMove,1300
gBh2R,2rq1rk1/7p/p1b1p1NP/2pp4/2P2b2/1pQP4/4BPP1/1K1R3R b - - 1 24,d8f6 c3f6 f8f6 g6e7 g8f8 e7c8,1305,100,advantage fork long middlegame,1300
gD2km,5r2/2RR1pb1/5k1p/4P3/2n2p2/1Nr5/P5P1/1B4K1 b - - 0 44,c4e5 d7d6 f6g5 c7c3,1305,100,advantage master middlegame short,1300
gXW2k,8/6p1/PR3p1p/8/8/kpr5/5PKP/8 b - - 0 41,b3b2 a6a7 c3c8 b6b8 c8b8 a7b8q,1305,100,advancedPawn crushing endgame long promotion rookEndgame,1300
gZT2o,3r4/p4kpp/2r2p2/4pN2/1b5P/2n2P2/P1R3P1/2R1B2K b - - 11 37,d8d1 c1d1 c3d1 c2c6,1305,100,advantage middlegame short,1300
h1xZ7,3r2rk/p5pp/1p1q1p2/2p1pP1Q/8/2PP2R1/PP4PP/5RK1 b - - 1 23,d6e7 h5h7 h8h7 g3h3,1305,100,attraction endgame kingsideAttack mate mateIn2 sacrifice short,1300
hCVb2,5rk1/ppp3pp/3b4/3Pn2r/7q/1Q5P/PPP1NPP1/R1B2RK1 w - - 5 18,e2g3 e5f3 b3f3 f8f3,1305,100,advantage kingsideAttack middlegame short,1300
hLR0j,2r3k1/6pp/4p2q/p3Pp1P/Pb6/4P3/Q4PP1/1K5R b - - 2 32,h6g5 a2e6 g8f8 e6c8,1305,100,crushing fork short,1300
hxgLM,2r3k1/3b1pP1/7p/q2p4/1p1p1Q2/r2P3P/1N1KBPP1/R6R w - - 3 23,h1c1 b4b3 d2d1 a3a1,1305,100,crushing discoveredAttack middlegame short,1300
i74X3,8/1p2Q3/pkpp1p2/4pP2/1P4P1/P2P4/1KP2RP1/2r1q3 w - - 16 42,e7d8 b6a7 d8d6 c1b1 b2a2 b1a1,1305,100,crushing endgame long,1300
iDyg1,4k3/6R1/5p1p/1p3K1P/6P1/pB2p1r1/P7/8 w - - 0 40,f5f4 e3e2 f4g3 e2e1q,1305,100,advancedPawn advantage endgame promotion short,1300
iFVUA,2kr3r/1p2bpp1/2p5/3p4/4PPp1/2NP2Pq/PPP2K2/R1B2RQ1 w - - 0 21,g1g2 e7c5 c1e3 c5e3 f2e3 h3g2,1305,100,crushing long middlegame,1300
ikvm2,r6k/pp3pr1/3R1N1p/2p1p2P/8/P2Q4/KPP2P2/6q1 b - - 5 29,g1f2 d6d8 a8d8 d3d8 g7g8 d8g8,1305,100,endgame exposedKing long mate mateIn3,1300
imFOY,6r1/pp1qbbk1/4p2r/2Pp1p2/1P3P2/P2BPQ1R/7P/6RK b - - 1 32,g7h7 h3h6 h7h6 f3h3 f7h5 g1g8,1305,100,attraction crushing deflection exposedKing long middlegame,1300
jNZ4c,8/8/3pk3/1P2p3/4P1K1/1r5R/8/8 b - - 0 45,b3h3 g4h3 e6d7 h3g4 d7c7 g4f5 c7b6 f5e6,1305,100,crushing endgame veryLong,1300
jX1t6,4qk1r/p4ppp/3b4/3p2P1/3pb3/2P1B2P/PP3P2/R2QK1R1 w Q - 0 18,c3d4 d6b4 e1f1 e8b5 d1e2 e4d3 e2d3 b5d3,1305,100,crushing middlegame pin veryLong,1300
ji5Si,7Q/8/p3p3/3k4/P7/5P2/5q2/2K5 b - - 3 50,f2f3 h8a8 d5d4 a8f3,1305,100,crushing endgame master masterVsMaster queenEndgame short skewer,1300
jovkr,r3k2r/pp2nppp/1q2p3/3pP3/3P4/N7/P2Q1PPP/1R3RK1 b kq - 2 15,b6c7 a3b5 c7d8 b5d6,1305,100,advantage middlegame short,1300
k6xAc,r5k1/2pq1ppp/p1np1n2/6N1/2NPr3/1P6/P1Q3PP/R4RK1 b - - 1 19,e4d4 f1f6 g7f6 c2h7,1305,100,advantage kingsideAttack middlegame short,1300
kqarJ,4rbkr/pp4pp/4b3/2q3B1/5Q2/5R2/PPP2PPP/4R1K1 b - - 9 23,f8d6 e1e6 d6f4 e6e8,1305,100,advantage kingsideAttack middlegame short,1300
l0zwu,r3r1k1/1p1b1ppp/p7/7R/3P4/P1q1B1Q1/5PPP/R5K1 w - - 9 21,a1c1 c3c1 e3c1 e8e1,1305,100,backRankMate mate mateIn2 middlegame sacrifice short,1300
